{
  "requirement_reference": "REQ-AUTH-204",
  "summary": "REQ-AUTH-204: Zero-Trust Step-Up Authentication",
  "actors": [
    "end user",
    "system"
  ],
  "business_rules": [
    {
      "id": "BR-1",
      "rule": "REQ-AUTH-204: Zero-Trust Step-Up Authentication",
      "source": "stated"
    },
    {
      "id": "BR-2",
      "rule": "The authentication service must enforce OAuth 2.0 Authorization Code flow with PKCE and adaptive risk-based MFA.",
      "source": "stated"
    },
    {
      "id": "BR-3",
      "rule": "- PKCE code_challenge (S256) is mandatory on all client authorization requests.",
      "source": "stated"
    },
    {
      "id": "BR-4",
      "rule": "- High-risk operations (e.g.",
      "source": "stated"
    }
  ],
  "scenarios": [
    {
      "id": "SC-1",
      "description": "Primary documented path: REQ-AUTH-204: Zero-Trust Step-Up Authentication",
      "category": "functional",
      "priority": "high",
      "rationale": "Derived from requirement statement REQ-AUTH-204"
    },
    {
      "id": "SC-2",
      "description": "Supported variation of REQ-AUTH-204: Zero-Trust Step-Up Authentication",
      "category": "functional",
      "priority": "medium",
      "rationale": "Derived from requirement statement REQ-AUTH-204"
    },
    {
      "id": "SC-3",
      "description": "Invalid input is rejected for REQ-AUTH-204: Zero-Trust Step-Up Authentication",
      "category": "negative",
      "priority": "high",
      "rationale": "Derived from requirement statement REQ-AUTH-204"
    },
    {
      "id": "SC-4",
      "description": "Unauthorized or out-of-state attempt at REQ-AUTH-204: Zero-Trust Step-Up Authentication",
      "category": "negative",
      "priority": "medium",
      "rationale": "Derived from requirement statement REQ-AUTH-204"
    },
    {
      "id": "SC-5",
      "description": "Limit and expiry conditions around REQ-AUTH-204: Zero-Trust Step-Up Authentication",
      "category": "boundary",
      "priority": "medium",
      "rationale": "Derived from requirement statement REQ-AUTH-204"
    },
    {
      "id": "SC-6",
      "description": "Field-level validation for REQ-AUTH-204: Zero-Trust Step-Up Authentication",
      "category": "validation",
      "priority": "high",
      "rationale": "Derived from requirement statement REQ-AUTH-204"
    },
    {
      "id": "SC-7",
      "description": "Required-field enforcement for REQ-AUTH-204: Zero-Trust Step-Up Authentication",
      "category": "validation",
      "priority": "medium",
      "rationale": "Derived from requirement statement REQ-AUTH-204"
    },
    {
      "id": "SC-8",
      "description": "Behaviour across data states for REQ-AUTH-204: Zero-Trust Step-Up Authentication",
      "category": "data",
      "priority": "low",
      "rationale": "Derived from requirement statement REQ-AUTH-204"
    }
  ],
  "coverage_dimensions": {
    "functional": [
      "happy path",
      "supported variation"
    ],
    "negative": [
      "invalid input",
      "unauthorized access"
    ],
    "boundary": [
      "minimum",
      "maximum",
      "expiry"
    ],
    "validation": [
      "format",
      "required fields"
    ],
    "data": [
      "differing data states"
    ]
  },
  "assumptions": [
    "Generated by the mock engine: scenarios are structural placeholders derived from the requirement text, not reasoned analysis."
  ],
  "risks": [
    "Mock engine output must not be used as real test coverage."
  ]
}