{
  "requirement_reference": "REQ-089",
  "summary": "REQ-089 Automated Merchant Refund Processing",
  "actors": [
    "end user",
    "system"
  ],
  "business_rules": [
    {
      "id": "BR-1",
      "rule": "REQ-089 Automated Merchant Refund Processing",
      "source": "stated"
    },
    {
      "id": "BR-2",
      "rule": "Provide a multi-tier refund processing API for global ecommerce merchants.",
      "source": "stated"
    },
    {
      "id": "BR-3",
      "rule": "- Partial refunds are permitted up to the total original transaction amount.",
      "source": "stated"
    },
    {
      "id": "BR-4",
      "rule": "- Refunds requested within 14 days must route to original payment method without interchange penalties.",
      "source": "stated"
    }
  ],
  "scenarios": [
    {
      "id": "SC-1",
      "description": "Primary documented path: REQ-089 Automated Merchant Refund Processing",
      "category": "functional",
      "priority": "high",
      "rationale": "Derived from requirement statement REQ-089"
    },
    {
      "id": "SC-2",
      "description": "Supported variation of REQ-089 Automated Merchant Refund Processing",
      "category": "functional",
      "priority": "medium",
      "rationale": "Derived from requirement statement REQ-089"
    },
    {
      "id": "SC-3",
      "description": "Invalid input is rejected for REQ-089 Automated Merchant Refund Processing",
      "category": "negative",
      "priority": "high",
      "rationale": "Derived from requirement statement REQ-089"
    },
    {
      "id": "SC-4",
      "description": "Unauthorized or out-of-state attempt at REQ-089 Automated Merchant Refund Processing",
      "category": "negative",
      "priority": "medium",
      "rationale": "Derived from requirement statement REQ-089"
    },
    {
      "id": "SC-5",
      "description": "Limit and expiry conditions around REQ-089 Automated Merchant Refund Processing",
      "category": "boundary",
      "priority": "medium",
      "rationale": "Derived from requirement statement REQ-089"
    },
    {
      "id": "SC-6",
      "description": "Field-level validation for REQ-089 Automated Merchant Refund Processing",
      "category": "validation",
      "priority": "high",
      "rationale": "Derived from requirement statement REQ-089"
    },
    {
      "id": "SC-7",
      "description": "Required-field enforcement for REQ-089 Automated Merchant Refund Processing",
      "category": "validation",
      "priority": "medium",
      "rationale": "Derived from requirement statement REQ-089"
    },
    {
      "id": "SC-8",
      "description": "Behaviour across data states for REQ-089 Automated Merchant Refund Processing",
      "category": "data",
      "priority": "low",
      "rationale": "Derived from requirement statement REQ-089"
    }
  ],
  "coverage_dimensions": {
    "functional": [
      "happy path",
      "supported variation"
    ],
    "negative": [
      "invalid input",
      "unauthorized access"
    ],
    "boundary": [
      "minimum",
      "maximum",
      "expiry"
    ],
    "validation": [
      "format",
      "required fields"
    ],
    "data": [
      "differing data states"
    ]
  },
  "assumptions": [
    "Generated by the mock engine: scenarios are structural placeholders derived from the requirement text, not reasoned analysis."
  ],
  "risks": [
    "Mock engine output must not be used as real test coverage."
  ]
}