{
  "requirement_reference": "REQ-SWIFT-101",
  "summary": "REQ-SWIFT-101: High-Value Cross-Border Wire Transfer",
  "actors": [
    "end user",
    "system"
  ],
  "business_rules": [
    {
      "id": "BR-1",
      "rule": "REQ-SWIFT-101: High-Value Cross-Border Wire Transfer",
      "source": "stated"
    },
    {
      "id": "BR-2",
      "rule": "The payments gateway must process SWIFT MT103 wire messages with real-time sanctions screening.",
      "source": "stated"
    },
    {
      "id": "BR-3",
      "rule": "- Transfers exceeding $1,000,000.00 require Dual-Control authorization.",
      "source": "stated"
    },
    {
      "id": "BR-4",
      "rule": "- Beneficiary IBAN and BIC must pass ISO 13616 modulus-97 validation before ledger debit.",
      "source": "stated"
    }
  ],
  "scenarios": [
    {
      "id": "SC-1",
      "description": "Primary documented path: REQ-SWIFT-101: High-Value Cross-Border Wire Transfer",
      "category": "functional",
      "priority": "high",
      "rationale": "Derived from requirement statement REQ-SWIFT-101"
    },
    {
      "id": "SC-2",
      "description": "Supported variation of REQ-SWIFT-101: High-Value Cross-Border Wire Transfer",
      "category": "functional",
      "priority": "medium",
      "rationale": "Derived from requirement statement REQ-SWIFT-101"
    },
    {
      "id": "SC-3",
      "description": "Invalid input is rejected for REQ-SWIFT-101: High-Value Cross-Border Wire Transfer",
      "category": "negative",
      "priority": "high",
      "rationale": "Derived from requirement statement REQ-SWIFT-101"
    },
    {
      "id": "SC-4",
      "description": "Unauthorized or out-of-state attempt at REQ-SWIFT-101: High-Value Cross-Border Wire Transfer",
      "category": "negative",
      "priority": "medium",
      "rationale": "Derived from requirement statement REQ-SWIFT-101"
    },
    {
      "id": "SC-5",
      "description": "Limit and expiry conditions around REQ-SWIFT-101: High-Value Cross-Border Wire Transfer",
      "category": "boundary",
      "priority": "medium",
      "rationale": "Derived from requirement statement REQ-SWIFT-101"
    },
    {
      "id": "SC-6",
      "description": "Field-level validation for REQ-SWIFT-101: High-Value Cross-Border Wire Transfer",
      "category": "validation",
      "priority": "high",
      "rationale": "Derived from requirement statement REQ-SWIFT-101"
    },
    {
      "id": "SC-7",
      "description": "Required-field enforcement for REQ-SWIFT-101: High-Value Cross-Border Wire Transfer",
      "category": "validation",
      "priority": "medium",
      "rationale": "Derived from requirement statement REQ-SWIFT-101"
    },
    {
      "id": "SC-8",
      "description": "Behaviour across data states for REQ-SWIFT-101: High-Value Cross-Border Wire Transfer",
      "category": "data",
      "priority": "low",
      "rationale": "Derived from requirement statement REQ-SWIFT-101"
    }
  ],
  "coverage_dimensions": {
    "functional": [
      "happy path",
      "supported variation"
    ],
    "negative": [
      "invalid input",
      "unauthorized access"
    ],
    "boundary": [
      "minimum",
      "maximum",
      "expiry"
    ],
    "validation": [
      "format",
      "required fields"
    ],
    "data": [
      "differing data states"
    ]
  },
  "assumptions": [
    "Generated by the mock engine: scenarios are structural placeholders derived from the requirement text, not reasoned analysis."
  ],
  "risks": [
    "Mock engine output must not be used as real test coverage."
  ]
}