{
  "requirement_reference": "REQ-042",
  "summary": "REQ-042 Password Reset",
  "actors": [
    "end user",
    "system"
  ],
  "business_rules": [
    {
      "id": "BR-1",
      "rule": "REQ-042 Password Reset",
      "source": "stated"
    },
    {
      "id": "BR-2",
      "rule": "A registered user should be able to reset their password using a registered email address.",
      "source": "stated"
    },
    {
      "id": "BR-3",
      "rule": "- The system sends a reset link to the email address if it is registered.",
      "source": "stated"
    },
    {
      "id": "BR-4",
      "rule": "- The reset link expires after 30 minutes.",
      "source": "stated"
    }
  ],
  "scenarios": [
    {
      "id": "SC-1",
      "description": "Primary documented path: REQ-042 Password Reset",
      "category": "functional",
      "priority": "high",
      "rationale": "Derived from requirement statement REQ-042"
    },
    {
      "id": "SC-2",
      "description": "Supported variation of REQ-042 Password Reset",
      "category": "functional",
      "priority": "medium",
      "rationale": "Derived from requirement statement REQ-042"
    },
    {
      "id": "SC-3",
      "description": "Invalid input is rejected for REQ-042 Password Reset",
      "category": "negative",
      "priority": "high",
      "rationale": "Derived from requirement statement REQ-042"
    },
    {
      "id": "SC-4",
      "description": "Unauthorized or out-of-state attempt at REQ-042 Password Reset",
      "category": "negative",
      "priority": "medium",
      "rationale": "Derived from requirement statement REQ-042"
    },
    {
      "id": "SC-5",
      "description": "Limit and expiry conditions around REQ-042 Password Reset",
      "category": "boundary",
      "priority": "medium",
      "rationale": "Derived from requirement statement REQ-042"
    },
    {
      "id": "SC-6",
      "description": "Field-level validation for REQ-042 Password Reset",
      "category": "validation",
      "priority": "high",
      "rationale": "Derived from requirement statement REQ-042"
    },
    {
      "id": "SC-7",
      "description": "Required-field enforcement for REQ-042 Password Reset",
      "category": "validation",
      "priority": "medium",
      "rationale": "Derived from requirement statement REQ-042"
    },
    {
      "id": "SC-8",
      "description": "Behaviour across data states for REQ-042 Password Reset",
      "category": "data",
      "priority": "low",
      "rationale": "Derived from requirement statement REQ-042"
    }
  ],
  "coverage_dimensions": {
    "functional": [
      "happy path",
      "supported variation"
    ],
    "negative": [
      "invalid input",
      "unauthorized access"
    ],
    "boundary": [
      "minimum",
      "maximum",
      "expiry"
    ],
    "validation": [
      "format",
      "required fields"
    ],
    "data": [
      "differing data states"
    ]
  },
  "assumptions": [
    "Generated by the mock engine: scenarios are structural placeholders derived from the requirement text, not reasoned analysis."
  ],
  "risks": [
    "Mock engine output must not be used as real test coverage."
  ]
}