{
  "requirement_reference": "REQ-108",
  "summary": "REQ-108 Instant Trade Settlement & Clearing",
  "actors": [
    "end user",
    "system"
  ],
  "business_rules": [
    {
      "id": "BR-1",
      "rule": "REQ-108 Instant Trade Settlement & Clearing",
      "source": "stated"
    },
    {
      "id": "BR-2",
      "rule": "As an institutional broker, execute real-time cross-currency trade settlements with bilateral counterparty risk verification.",
      "source": "stated"
    },
    {
      "id": "BR-3",
      "rule": "- Orders above $1,000,000 USD require dual-authorization before routing.",
      "source": "stated"
    },
    {
      "id": "BR-4",
      "rule": "- The clearing engine must validate sufficient margin balance in the trading account before lock-in.",
      "source": "stated"
    }
  ],
  "scenarios": [
    {
      "id": "SC-1",
      "description": "Primary documented path: REQ-108 Instant Trade Settlement & Clearing",
      "category": "functional",
      "priority": "high",
      "rationale": "Derived from requirement statement REQ-108"
    },
    {
      "id": "SC-2",
      "description": "Supported variation of REQ-108 Instant Trade Settlement & Clearing",
      "category": "functional",
      "priority": "medium",
      "rationale": "Derived from requirement statement REQ-108"
    },
    {
      "id": "SC-3",
      "description": "Invalid input is rejected for REQ-108 Instant Trade Settlement & Clearing",
      "category": "negative",
      "priority": "high",
      "rationale": "Derived from requirement statement REQ-108"
    },
    {
      "id": "SC-4",
      "description": "Unauthorized or out-of-state attempt at REQ-108 Instant Trade Settlement & Clearing",
      "category": "negative",
      "priority": "medium",
      "rationale": "Derived from requirement statement REQ-108"
    },
    {
      "id": "SC-5",
      "description": "Limit and expiry conditions around REQ-108 Instant Trade Settlement & Clearing",
      "category": "boundary",
      "priority": "medium",
      "rationale": "Derived from requirement statement REQ-108"
    },
    {
      "id": "SC-6",
      "description": "Field-level validation for REQ-108 Instant Trade Settlement & Clearing",
      "category": "validation",
      "priority": "high",
      "rationale": "Derived from requirement statement REQ-108"
    },
    {
      "id": "SC-7",
      "description": "Required-field enforcement for REQ-108 Instant Trade Settlement & Clearing",
      "category": "validation",
      "priority": "medium",
      "rationale": "Derived from requirement statement REQ-108"
    },
    {
      "id": "SC-8",
      "description": "Behaviour across data states for REQ-108 Instant Trade Settlement & Clearing",
      "category": "data",
      "priority": "low",
      "rationale": "Derived from requirement statement REQ-108"
    }
  ],
  "coverage_dimensions": {
    "functional": [
      "happy path",
      "supported variation"
    ],
    "negative": [
      "invalid input",
      "unauthorized access"
    ],
    "boundary": [
      "minimum",
      "maximum",
      "expiry"
    ],
    "validation": [
      "format",
      "required fields"
    ],
    "data": [
      "differing data states"
    ]
  },
  "assumptions": [
    "Generated by the mock engine: scenarios are structural placeholders derived from the requirement text, not reasoned analysis."
  ],
  "risks": [
    "Mock engine output must not be used as real test coverage."
  ]
}