{
  "requirement_reference": "REQ-100",
  "summary": "REQ-100 User Login and Session Management",
  "actors": [
    "end user",
    "system"
  ],
  "business_rules": [
    {
      "id": "BR-1",
      "rule": "REQ-100 User Login and Session Management",
      "source": "stated"
    },
    {
      "id": "BR-2",
      "rule": "As a verified user, I must be able to securely authenticate using username and password.",
      "source": "stated"
    },
    {
      "id": "BR-3",
      "rule": "Given valid credentials, the system authenticates within 1.5 seconds and returns a session token.",
      "source": "stated"
    },
    {
      "id": "BR-4",
      "rule": "If password is invalid, the system responds with Invalid Credentials.",
      "source": "stated"
    }
  ],
  "scenarios": [
    {
      "id": "SC-1",
      "description": "Primary documented path: REQ-100 User Login and Session Management",
      "category": "functional",
      "priority": "high",
      "rationale": "Derived from requirement statement REQ-100"
    },
    {
      "id": "SC-2",
      "description": "Supported variation of REQ-100 User Login and Session Management",
      "category": "functional",
      "priority": "medium",
      "rationale": "Derived from requirement statement REQ-100"
    },
    {
      "id": "SC-3",
      "description": "Invalid input is rejected for REQ-100 User Login and Session Management",
      "category": "negative",
      "priority": "high",
      "rationale": "Derived from requirement statement REQ-100"
    },
    {
      "id": "SC-4",
      "description": "Unauthorized or out-of-state attempt at REQ-100 User Login and Session Management",
      "category": "negative",
      "priority": "medium",
      "rationale": "Derived from requirement statement REQ-100"
    },
    {
      "id": "SC-5",
      "description": "Limit and expiry conditions around REQ-100 User Login and Session Management",
      "category": "boundary",
      "priority": "medium",
      "rationale": "Derived from requirement statement REQ-100"
    },
    {
      "id": "SC-6",
      "description": "Field-level validation for REQ-100 User Login and Session Management",
      "category": "validation",
      "priority": "high",
      "rationale": "Derived from requirement statement REQ-100"
    },
    {
      "id": "SC-7",
      "description": "Required-field enforcement for REQ-100 User Login and Session Management",
      "category": "validation",
      "priority": "medium",
      "rationale": "Derived from requirement statement REQ-100"
    },
    {
      "id": "SC-8",
      "description": "Behaviour across data states for REQ-100 User Login and Session Management",
      "category": "data",
      "priority": "low",
      "rationale": "Derived from requirement statement REQ-100"
    }
  ],
  "coverage_dimensions": {
    "functional": [
      "happy path",
      "supported variation"
    ],
    "negative": [
      "invalid input",
      "unauthorized access"
    ],
    "boundary": [
      "minimum",
      "maximum",
      "expiry"
    ],
    "validation": [
      "format",
      "required fields"
    ],
    "data": [
      "differing data states"
    ]
  },
  "assumptions": [
    "Generated by the mock engine: scenarios are structural placeholders derived from the requirement text, not reasoned analysis."
  ],
  "risks": [
    "Mock engine output must not be used as real test coverage."
  ]
}