{
  "requirement_reference": "REQ-001",
  "summary": "create sample test case for facebook",
  "actors": [
    "end user",
    "system"
  ],
  "business_rules": [
    {
      "id": "BR-1",
      "rule": "create sample test case for facebook",
      "source": "stated"
    }
  ],
  "scenarios": [
    {
      "id": "SC-1",
      "description": "Primary documented path: create sample test case for facebook",
      "category": "functional",
      "priority": "high",
      "rationale": "Derived from requirement statement REQ-001"
    },
    {
      "id": "SC-2",
      "description": "Supported variation of create sample test case for facebook",
      "category": "functional",
      "priority": "medium",
      "rationale": "Derived from requirement statement REQ-001"
    },
    {
      "id": "SC-3",
      "description": "Invalid input is rejected for create sample test case for facebook",
      "category": "negative",
      "priority": "high",
      "rationale": "Derived from requirement statement REQ-001"
    },
    {
      "id": "SC-4",
      "description": "Unauthorized or out-of-state attempt at create sample test case for facebook",
      "category": "negative",
      "priority": "medium",
      "rationale": "Derived from requirement statement REQ-001"
    },
    {
      "id": "SC-5",
      "description": "Limit and expiry conditions around create sample test case for facebook",
      "category": "boundary",
      "priority": "medium",
      "rationale": "Derived from requirement statement REQ-001"
    },
    {
      "id": "SC-6",
      "description": "Field-level validation for create sample test case for facebook",
      "category": "validation",
      "priority": "high",
      "rationale": "Derived from requirement statement REQ-001"
    },
    {
      "id": "SC-7",
      "description": "Required-field enforcement for create sample test case for facebook",
      "category": "validation",
      "priority": "medium",
      "rationale": "Derived from requirement statement REQ-001"
    },
    {
      "id": "SC-8",
      "description": "Behaviour across data states for create sample test case for facebook",
      "category": "data",
      "priority": "low",
      "rationale": "Derived from requirement statement REQ-001"
    }
  ],
  "coverage_dimensions": {
    "functional": [
      "happy path",
      "supported variation"
    ],
    "negative": [
      "invalid input",
      "unauthorized access"
    ],
    "boundary": [
      "minimum",
      "maximum",
      "expiry"
    ],
    "validation": [
      "format",
      "required fields"
    ],
    "data": [
      "differing data states"
    ]
  },
  "assumptions": [
    "Generated by the mock engine: scenarios are structural placeholders derived from the requirement text, not reasoned analysis."
  ],
  "risks": [
    "Mock engine output must not be used as real test coverage."
  ]
}