{
  "requirement_reference": "REQ-1042",
  "summary": "# REQ-1042 \u2014 Schedule a Recurring Payment",
  "actors": [
    "end user",
    "system"
  ],
  "business_rules": [
    {
      "id": "BR-1",
      "rule": "# REQ-1042 \u2014 Schedule a Recurring Payment",
      "source": "stated"
    },
    {
      "id": "BR-2",
      "rule": "## Business value",
      "source": "stated"
    },
    {
      "id": "BR-3",
      "rule": "Retail customers who pay the same beneficiary on a fixed schedule (rent, school",
      "source": "stated"
    },
    {
      "id": "BR-4",
      "rule": "fees, loan instalments) currently re-enter the payment every month and miss due",
      "source": "stated"
    }
  ],
  "scenarios": [
    {
      "id": "SC-1",
      "description": "Primary documented path: # REQ-1042 \u2014 Schedule a Recurring Payment",
      "category": "functional",
      "priority": "high",
      "rationale": "Derived from requirement statement REQ-1042"
    },
    {
      "id": "SC-2",
      "description": "Supported variation of # REQ-1042 \u2014 Schedule a Recurring Payment",
      "category": "functional",
      "priority": "medium",
      "rationale": "Derived from requirement statement REQ-1042"
    },
    {
      "id": "SC-3",
      "description": "Invalid input is rejected for # REQ-1042 \u2014 Schedule a Recurring Payment",
      "category": "negative",
      "priority": "high",
      "rationale": "Derived from requirement statement REQ-1042"
    },
    {
      "id": "SC-4",
      "description": "Unauthorized or out-of-state attempt at # REQ-1042 \u2014 Schedule a Recurring Payment",
      "category": "negative",
      "priority": "medium",
      "rationale": "Derived from requirement statement REQ-1042"
    },
    {
      "id": "SC-5",
      "description": "Limit and expiry conditions around # REQ-1042 \u2014 Schedule a Recurring Payment",
      "category": "boundary",
      "priority": "medium",
      "rationale": "Derived from requirement statement REQ-1042"
    },
    {
      "id": "SC-6",
      "description": "Field-level validation for # REQ-1042 \u2014 Schedule a Recurring Payment",
      "category": "validation",
      "priority": "high",
      "rationale": "Derived from requirement statement REQ-1042"
    },
    {
      "id": "SC-7",
      "description": "Required-field enforcement for # REQ-1042 \u2014 Schedule a Recurring Payment",
      "category": "validation",
      "priority": "medium",
      "rationale": "Derived from requirement statement REQ-1042"
    },
    {
      "id": "SC-8",
      "description": "Behaviour across data states for # REQ-1042 \u2014 Schedule a Recurring Payment",
      "category": "data",
      "priority": "low",
      "rationale": "Derived from requirement statement REQ-1042"
    }
  ],
  "coverage_dimensions": {
    "functional": [
      "happy path",
      "supported variation"
    ],
    "negative": [
      "invalid input",
      "unauthorized access"
    ],
    "boundary": [
      "minimum",
      "maximum",
      "expiry"
    ],
    "validation": [
      "format",
      "required fields"
    ],
    "data": [
      "differing data states"
    ]
  },
  "assumptions": [
    "Generated by the mock engine: scenarios are structural placeholders derived from the requirement text, not reasoned analysis."
  ],
  "risks": [
    "Mock engine output must not be used as real test coverage."
  ]
}